ev03_0045_0000;Careful! He the-looks like he’s all muscle!
ev03_0045_0001;All right! Let’s turn up the heat!
ev03_0045_0002;Uh, I think he’s got that part covered...
ev03_0045_0003;She looks the-ready to knock us cold!
ev03_0045_0004;Knock us cold for [f2]what?[/f][~]Help me out here!
ev03_0045_0005;I hope this doesn’t traumatize you.
ev03_0045_0006;Watch it. For an old guy, he looks pretty tough.
ev03_0045_0007;Dude, “tough” doesn’t even begin to describe it.
ev03_0045_0008;Be the-careful![~]Remember, we’re still the-inside their threshold!
