ev03_add_battle_00_0000;Are you kidding me?! Mirages can stack too?
ev03_add_battle_00_0001;Yup. You’re not the only ones[~]who get way the-stronger when you’re piled up.
ev03_add_battle_00_0002;Do their abilities change when they’re stacked too, then?
ev03_add_battle_00_0003;Afraid the-so![~]Which means [f2]somebody[/f] needs to stop underestimating the enemy[~]before he the-finds himself up to his neck in some—
ev03_add_battle_00_0004;Okay!
ev03_add_battle_00_0005;At least he knows the warning’s meant for him.
