ev08_0025_0000;Ooogh, I’m really starting to get sick of all this cold...
ev08_0025_0001;Maybe you should have thought of that the-[f2]before[/f] you came up with this plan.
ev08_0025_0002;Yeah, Lann! Nobody ever said anything about having to fight past all these stupid Mirages.
ev08_0025_0003;Oh well. I did read that cold weather helps keep you focused, so I guess it’s not all that bad.
ev08_0025_0004;See, shivering uses less energy than a—
ev08_0025_0005;Ahhh! Man, do I just [f2]love[/f] the cold! Well, come on, come on! No time like the present!
