General_Town_Quest_npc_01_A_01;Ugh, my eyes are killing me! Maybe I’ve been working too hard... But I can’t stop until I’ve...
General_Town_Quest_npc_01_A_02;Oh! You there! Your timing is perfect!
General_Town_Quest_npc_01_A_03;If you have any extra eye drops you can spare, I could really use some right now.
General_Town_Quest_npc_01_B;Ugh... Everything’s so blurry I can barely see...
General_Town_Quest_npc_01_C_01;Oh, thank you! That’s much better. Now I can get on with my work!
General_Town_Quest_npc_01_C_02;Take this. You earned it.
General_Town_Quest_npc_01_D;Make sure that you take a break now and then too, okay?
