Nibelheim_npc_03_A_01;DELETED
Nibelheim_npc_03_A_02;The Federation’s Mirages keep coming after this town. They won’t leave us alone. But whenever they show up, that’s when we step in.
Nibelheim_npc_03_B_01;I’ve never fought anything like those strange machines before. They’re so strong, and there’s so many of them...
Nibelheim_npc_03_B_02;This town may not last much longer...
Nibelheim_npc_03_C_01;Whew... We somehow managed to keep those machines at bay. But you know, I still wonder: just what the blazes [f2]were[/f] those things?
Nibelheim_npc_03_C_02;DELETED
