npc_shantotto_0000_0000;Ah. Have you got another mess you need repressed?
npc_shantotto_0000_0001;You’d be amazed at what I’ve wrought from that ruby you brought.
npc_shantotto_0000_0002;I reckon I couldn’t convince you to fetch me a second?
npc_shantotto_0000_0003;Nothing better to do?
npc_shantotto_0000_0004;Make no mistake: only my curses have the power to save the world in its darkest, dire hour.
npc_shantotto_0000_0005;I’m presently employed. Go away, before I’m annoyed.
npc_shantotto_0000_0006;I am beginning to tire of that obnoxious flier...
