PortTown_npc_08_A_01;People say that someone really, really scary lives right here in town, but I’ve never met anyone like that.
PortTown_npc_08_A_02;DELETED
PortTown_npc_08_B_01;Have you met Miss Shantotto yet? She’s the best! She’s adorable, and elegant, and just plain wonderful!
PortTown_npc_08_B_02;DELETED
PortTown_npc_08_C;I don’t know why this is all happening, but I do know we’ll all be safe here as long as Miss Shantotto is around!
PortTown_npc_08_D;Ahh... Just thinking about Miss Shantotto makes me happy. She’s so...wonderful!
