sub25_075_0000;This the culprit we’re after, Serafie?
sub25_075_0001;Well, it does look exactly like[~]Tama does in her more regal form...
sub25_075_0002;All right, then let’s imprism it!
sub25_075_0003;Oh, but don’t forget that it has multiple lives.
sub25_075_0004;For now, forget about imprisming it.[~]You should focus on defeating it.
sub25_075_0005;All right, then that’s what we’ll do. Lann, you ready?
sub25_075_0006;Right on. And then it can give us its souls!
sub25_075_0007;Ha ha ha! All you need now is a hood and a scythe.
