sub24_010_0000;Something’s out there.
sub24_010_0001;Grrrrrr...
sub24_010_0002;I know, Fenrir, you can sense it too.
sub24_010_0003;If it’s making my horn act up like this,[~]then it can only be a Mirage with some kind of connection to my tribe.
sub24_010_0004;We’d better go check it out.
sub24_010_0005;Hmm... Is this the spot?
sub24_010_0006;Grrr...
sub24_010_0007;I can feel it...[~]Are you the Mirage who’s been calling us?
sub24_010_0008;What is it? You don’t mean to [f2]fight[/f] us?
sub24_010_0009;Fenrir. Get ready!
