ev01_0017_0000;Primero tendréis que debilitar al mirage antes de usar el prisma correspondiente.
ev01_0017_0001;Si vuestro intento de capturita falla, puede que el mirage contraataque o, peor aún, ¡ponga pies en polvorosa!
ev01_0017_0002;¡Bien! ¿Veis eso? Este es el momento ideal para usar el prisma y atrapar al chocobito.
ev01_0017_0003;Venga, seleccionad la acción Capturar.
ev01_0017_0004;Quizá tengáis que probar diferentes métodos antes de que podáis capturar un mirage dentro de un prisma. ¡Intentad ser creativos!
ev01_0017_0005;¡Bien hecho! Ahora ya tenéis el prismárium del chocobito. ¡Podéis usarlo cuando queráis!
ev01_0017_0005_1;3221225472
ev01_0017_0006;Ah, si queréis atrapar ese mirage, primero tendréis que derribar su torre.
ev01_0017_0007;Si el mirage se encuentra acopladito a otros, os resultará imposible capturarlo y convertirlo en prismárium.
