ev19_0050_0000;Qué serviciales son. Han conseguido calmar a la invocadora y al esper de un plumazo. Maravilloso.
ev19_0050_0001;Han logrado así someter al último peón del tablero. Ja, ja, ja, ja.
ev19_0050_0002;El interior es también bastante diferente.
ev19_0050_0003;Y tampoco veo ascensor alguno.
ev19_0050_0004;¡Ay, no!
ev19_0050_0005;Tendremos que subir las escaleritas, de escalón en escalón.
ev19_0050_0006;Vamos, ¡seguro que podéis!
ev19_0050_0007;Qué lista es la bola de pelo voladora esta...
