npc_sera_0000_0000;Sé que nos salvaréis.
npc_sera_0000_0001;¿Qué os trae por aquí?
npc_sera_0000_0002;Mi casa es vuestra casa.
npc_sera_0000_0003;Creo que la luz de la esperanza siempre disipa la oscuridad de la desesperanza.
npc_sera_0000_0004;Un placer veros, amigos.
npc_sera_0000_0005;Antes de llegar a Saronia tendréis que cruzar el bosque al norte y, a continuación, atravesar una gélida tundra.
npc_sera_0000_0006;Recordad que en ambos lugares encontraréis mirages. Prometedme que extremaréis las precauciones.
