sub02_020_0000;(Siempre pensé que no era más que una leyenda... Un cuento que se les contaba a los niños cuando se iban a la cama.)
sub02_020_0001;(Pero los Guerreros de la Luz existen. Yo soy uno de ellos. Sé que parece increíble, pero creo que este poder ya se manifestó en mí antes.)
sub02_020_0002;Estoy más cansado de lo que creía. Son demasiadas emociones para mí.
sub02_020_0003;¿Eh?
sub02_020_0004;No la encontrarás aquí.
sub02_020_0005;La princesa prefiere estar con el pueblo llano. Apenas suele estar aquí.
